{
  "$schema": "http://json-schema.org/draft-07/schema#",
  "title": "presentation_ladder",
  "description": "Phase 15 呈现阶梯:数据驱动的呈现增量批定义。游戏语义只存在于项目层实例,机制只消费结构字段(防固化)。",
  "type": "object",
  "additionalProperties": false,
  "required": ["ladder_schema_version", "ladder_id", "target_plugin_root", "rungs"],
  "properties": {
    "ladder_schema_version": {"const": "1.0.0", "description": "schema 版本(当前钉死 1.0.0)"},
    "ladder_id": {"type": "string", "pattern": "^ladder-[a-z0-9-]+$", "description": "阶梯实例 id"},
    "target_plugin_root": {"type": "string", "minLength": 1, "description": "demo plugin 根(相对项目根)"},
    "rungs": {
      "type": "array", "minItems": 1,
      "items": {
        "type": "object", "additionalProperties": false,
        "required": ["rung_id", "title", "stories"],
        "properties": {
          "rung_id": {"type": "integer", "minimum": 1, "description": "阶梯层级(批次 id = presentation-<rung_id>)"},
          "title": {"type": "string", "minLength": 1, "description": "层级标题(人读)"},
          "gdd_anchors": {"type": "array", "items": {"type": "string"}, "description": "相关 GDD 锚点(可选)"},
          "supersedes": {"type": "array", "items": {"type": "string"},
                         "description": "本 rung 显式退役的下层实现用例文件(相对项目根);hash 守门据此放行"},
          "stories": {
            "type": "array", "minItems": 1,
            "items": {
              "type": "object", "additionalProperties": false,
              "required": ["story_slug", "summary", "evidence_class", "requirements"],
              "properties": {
                "story_slug": {"type": "string", "pattern": "^[a-z0-9-]+$", "description": "story id 派生用 slug"},
                "summary": {"type": "string", "minLength": 1, "description": "工单概要(人读)"},
                "evidence_class": {"enum": ["Logic", "Integration", "Visual", "Config"],
                                   "description": "显式证据分级(呈现批不走 domain_type 映射)"},
                "requirements": {"type": "array", "items": {"type": "string"}, "minItems": 1,
                                 "description": "呈现要求清单(进 acceptance_criteria 前段)"},
                "interaction_claims": {
                  "type": "array",
                  "items": {"type": "object", "additionalProperties": false,
                            "required": ["input", "behavior"],
                            "properties": {"input": {"type": "string", "minLength": 1},
                                           "behavior": {"type": "string", "minLength": 1}}},
                  "description": "交互宣称(喂行为校验门禁)"
                }
              }
            }
          }
        }
      }
    }
  }
}
